<?xml version="1.0" encoding="UTF-8"?>
<RealEstate xmlns:xsi="http://www.w3.org/2001/XMLSchema-instance"
            xsi:noNamespaceSchemaLocation="RealEstatePlat.Schema.xsd">
<!-- Document root element, which references the XSD schema for validation -->
    
    <!-- Section: Users (10 entries) -->

    <Users>
        <!-- Users 1 -->
        <User>
            <id>1</id>
            <firstName>Alice</firstName>
            <lastName>Dupont</lastName>
            <email>alice.dupont@example.com</email>
            <phoneNumber>0123456789</phoneNumber>
            <address>
                <street>123 Rue de Paris</street>
                <city>Paris</city>
                <state>Île-de-France</state>
                <postalCode>75000</postalCode>
                <country>France</country>
                <latitude>48.8566</latitude>
                <longitude>2.3522</longitude>
            </address>
            <role>buyer</role>
            <registrationDate>2023-01-15</registrationDate>
            <isActive>true</isActive>
            <profilePicture>http://example.com/images/alice.jpg</profilePicture>
            <rating>4.5</rating>
        </User>
        <!-- Users 2 -->
        <User>
            <id>2</id>
            <firstName>Bob</firstName>
            <lastName>Martin</lastName>
            <email>bob.martin@example.com</email>
            <phoneNumber>0987654321</phoneNumber>
            <address>
                <street>45 Avenue Victor Hugo</street>
                <city>Lyon</city>
                <state>Auvergne-Rhône-Alpes</state>
                <postalCode>69007</postalCode>
                <country>France</country>
            </address>
            <role>seller</role>
            <registrationDate>2023-02-20</registrationDate>
            <isActive>true</isActive>
            <profilePicture>http://example.com/images/bob.jpg</profilePicture>
        </User>
        <!-- User 3 -->
        <User>
            <id>3</id>
            <firstName>Claire</firstName>
            <lastName>Durand</lastName>
            <email>claire.durand@example.com</email>
            <phoneNumber>0112233445</phoneNumber>
            <address>
                <street>78 Boulevard Saint-Germain</street>
                <city>Paris</city>
                <state>Île-de-France</state>
                <postalCode>75005</postalCode>
                <country>France</country>
            </address>
            <role>agent</role>
            <registrationDate>2023-03-05</registrationDate>
            <isActive>true</isActive>
        </User>
        <!-- User 4 -->
        <User>
            <id>4</id>
            <firstName>David</firstName>
            <lastName>Moreau</lastName>
            <email>david.moreau@example.com</email>
            <phoneNumber>0123987654</phoneNumber>
            <address>
                <street>25 Rue de la République</street>
                <city>Marseille</city>
                <state>Provence-Alpes-Côte d'Azur</state>
                <postalCode>13001</postalCode>
                <country>France</country>
            </address>
            <role>tenant</role>
            <registrationDate>2023-04-10</registrationDate>
            <isActive>true</isActive>
        </User>
        <!-- User 5 -->
        <User>
            <id>5</id>
            <firstName>Emma</firstName>
            <lastName>Leroy</lastName>
            <email>emma.leroy@example.com</email>
            <phoneNumber>0156789123</phoneNumber>
            <address>
                <street>12 Rue Victor Hugo</street>
                <city>Bordeaux</city>
                <state>Nouvelle-Aquitaine</state>
                <postalCode>33000</postalCode>
                <country>France</country>
            </address>
            <role>buyer</role>
            <registrationDate>2023-05-22</registrationDate>
            <isActive>false</isActive>
        </User>
        <!-- User 6 -->
        <User>
            <id>6</id>
            <firstName>Franck</firstName>
            <lastName>Garnier</lastName>
            <email>franck.garnier@example.com</email>
            <phoneNumber>0167891234</phoneNumber>
            <address>
                <street>89 Rue de Lille</street>
                <city>Lille</city>
                <state>Hauts-de-France</state>
                <postalCode>59000</postalCode>
                <country>France</country>
            </address>
            <role>seller</role>
            <registrationDate>2023-06-15</registrationDate>
            <isActive>true</isActive>
        </User>
        <!-- User 7 -->
        <User>
            <id>7</id>
            <firstName>Gabrielle</firstName>
            <lastName>Petit</lastName>
            <email>gabrielle.petit@example.com</email>
            <phoneNumber>0178912345</phoneNumber>
            <address>
                <street>3 Avenue des Champs-Élysées</street>
                <city>Paris</city>
                <state>Île-de-France</state>
                <postalCode>75008</postalCode>
                <country>France</country>
            </address>
            <role>agent</role>
            <registrationDate>2023-07-03</registrationDate>
            <isActive>true</isActive>
        </User>
        <!-- User 8 -->
        <User>
            <id>8</id>
            <firstName>Hugo</firstName>
            <lastName>Roux</lastName>
            <email>hugo.roux@example.com</email>
            <phoneNumber>0189123456</phoneNumber>
            <address>
                <street>56 Rue Nationale</street>
                <city>Strasbourg</city>
                <state>Grand Est</state>
                <postalCode>67000</postalCode>
                <country>France</country>
            </address>
            <role>tenant</role>
            <registrationDate>2023-08-12</registrationDate>
            <isActive>true</isActive>
        </User>
        <!-- User 9 -->
        <User>
            <id>9</id>
            <firstName>Isabelle</firstName>
            <lastName>Morel</lastName>
            <email>isabelle.morel@example.com</email>
            <phoneNumber>0191234567</phoneNumber>
            <address>
                <street>100 Rue de Lyon</street>
                <city>Lyon</city>
                <state>Auvergne-Rhône-Alpes</state>
                <postalCode>69002</postalCode>
                <country>France</country>
            </address>
            <role>buyer</role>
            <registrationDate>2023-09-01</registrationDate>
            <isActive>false</isActive>
        </User>
        <!-- User 10 -->
        <User>
            <id>10</id>
            <firstName>Julien</firstName>
            <lastName>Garcia</lastName>
            <email>julien.garcia@example.com</email>
            <phoneNumber>0102345678</phoneNumber>
            <address>
                <street>77 Boulevard de la République</street>
                <city>Nantes</city>
                <state>Pays de la Loire</state>
                <postalCode>44000</postalCode>
                <country>France</country>
            </address>
            <role>seller</role>
            <registrationDate>2023-10-10</registrationDate>
            <isActive>true</isActive>
        </User>
    </Users>
    
    <!-- Section: Properties (8 entries) -->

    <Properties>
        <!-- Property 101 -->
        <Property>
            <propertyId>101</propertyId>
            <title>Bright apartment</title>
            <description>3-room apartment in the heart of Paris.</description>
            <address>
                <street>45 Rue de Rivoli</street>
                <city>Paris</city>
                <state>Île-de-France</state>
                <postalCode>75004</postalCode>
                <country>France</country>
            </address>
            <price>350000.00</price>
            <area>80.5</area>
            <numberOfRooms>3</numberOfRooms>
            <propertyType>apartment</propertyType>
            <listingDate>2023-02-01</listingDate>
            <status>available</status>
            <features>
                <feature>Balcony</feature>
                <feature>View of the Eiffel Tower</feature>
            </features>
            <images>
                <image>http://example.com/images/property101_1.jpg</image>
                <image>http://example.com/images/property101_2.jpg</image>
            </images>
            <ownerId>2</ownerId>
        </Property>
        <!-- Property 102 -->
        <Property>
            <propertyId>102</propertyId>
            <title>Family home</title>
            <description>Large house with garden on the outskirts of Lyon.</description>
            <address>
                <street>12 Rue des Fleurs</street>
                <city>Lyon</city>
                <state>Auvergne-Rhône-Alpes</state>
                <postalCode>69003</postalCode>
                <country>France</country>
            </address>
            <price>450000.00</price>
            <area>150.0</area>
            <numberOfRooms>5</numberOfRooms>
            <propertyType>house</propertyType>
            <listingDate>2023-03-10</listingDate>
            <status>available</status>
            <features>
                <feature>Garden</feature>
                <feature>Garage</feature>
            </features>
            <images>
                <image>http://example.com/images/property102_1.jpg</image>
            </images>
            <ownerId>5</ownerId>
        </Property>
        <!-- Property 103 -->
        <Property>
            <propertyId>103</propertyId>
            <title>Luxury villa</title>
            <description>Modern villa with pool and panoramic view.</description>
            <address>